{
  "object_id": "aos:rules:CandidateRuleRecord:schema-first-rule",
  "object_kind": "CandidateRuleRecord",
  "rule_id": "CR-SCHEMA-FIRST-001",
  "source_lesson_ref": "L-CI-SELFCAL-002",
  "rule_body": "All governance document types must be defined in a single schema file. Both checker and script consumers must load from this schema. Adding a doc_type requires editing only one file.",
  "proposed_enforcement": "shadow",
  "shadow_evaluation_refs": [],
  "not_claimed": [
    "CandidateRule is not Policy",
    "Shadow enforcement is not blocking enforcement",
    "This rule has not been red-teamed",
    "This is a dogfood submission"
  ]
}
